brand,title,type,price,priceWithCurrency,available,availableText,sold,lastUpdated,itemLocation,genero
Al Rehab,WITHOUT BOX - 50ml (1.65 fl oz) Al Rehab Choco Musk Concentrated Perfume Oil,Perfume,8.99,US $8.99/ea,7.0,7 available / 76 sold,76.0,"Mar 22, 2024 06:23:29 PDT","Lynbrook, New York, United States",Hombre
Cologne,New 10x New Random Unique Men's Fragrance Cologne Sample Set Christimas Gift Set,Perfume,19.9,US $19.90,0.0,More than 10 lots available (10 items per lot) / 331 sold,331.0,"Nov 21, 2023 08:32:55 PST","Stony Brook, New York, United States",Hombre
BOD man,"BOD Man Fragrance Body Spray, Black, 8 fl oz Fresh Free Shipping",Fragrance Body Spray,9.99,US $9.99/ea,3.0,3 available / 32 sold,32.0,"May 22, 2024 17:01:35 PDT","Multiple Locations, United States",Hombre
Diesel,Diesel Only The Brave by Diesel EDT Cologne for Men 6.7 oz New In Box,Eau de Toilette,56.0,US $56.00/ea,3.0,3 available / 677 sold,677.0,"May 20, 2024 15:18:21 PDT","Hackensack, New Jersey, United States",Hombre
Amouage,Amouage Interlude by Amouage 3.4 oz EDP Cologne for Men New In Box,Eau de Parfum,166.18,US $166.18/ea,10.0,More than 10 available / 78 sold,78.0,"May 22, 2024 07:34:36 PDT","Hackensack, New Jersey, United States",Hombre
Ralph Lauren,Polo Blue by Ralph Lauren EDT for Men 2.5oz - 75ml *NEW IN SEALED BOX*,Eau de Cologne,29.99,US $29.99,10.0,More than 10 available / 60 sold,60.0,"May 10, 2024 07:19:49 PDT","Miami, Florida, United States",Hombre
Rasasi,Rasasi It's Essential for Men Long Lasting Eau De Parfum- 100ml- FREE SHIPPING,Eau de Parfum,38.0,US $38.00,8.0,8 available / 12 sold,12.0,"May 17, 2024 18:15:39 PDT","DELHI, DELHI, India",Hombre
Bvlgari,Bvlgari Man In Black Made Stronger With Pheromones For Super Sexy Scent Trails!,Eau de Toilette,16.48,US $16.48,10.0,More than 10 available / 24 sold,24.0,"May 19, 2024 18:22:54 PDT","Austell, Georgia, United States",Hombre
Armaf,Armaf club de nuit UNTOLD 6.7oz/200ml Eau de Parfum Unisex Spray - New & Sealed,Eau de Parfum,85.0,US $85.00,10.0,More than 10 available / 10 sold,10.0,"Apr 24, 2024 15:40:00 PDT","Houston, Texas, United States",Hombre
Armaf,Armaf Odyssey Mandarin Sky Eau De Parfum for Men 100ml - FREE SHIPPING,Eau de Parfum,41.0,US $41.00,8.0,8 available / 397 sold,397.0,"May 16, 2024 08:19:57 PDT","DELHI, DELHI, India",Hombre
Dana,Women TABU by DANA 2.3 oz EDC Spray New In Box (NOT 3.0),Eau de Cologne,14.99,US $14.99/ea,10.0,More than 10 available / 647 sold,647.0,"Feb 16, 2024 20:33:33 PST","Orlando, Florida, United States",Hombre
Carolina Herrera,HERRERA FOR MEN * Carolina Herrera Cologne * EDT * 6.7 / 6.8 oz * NEW IN BOX,Eau de Toilette,66.52,US $66.52/ea,10.0,"More than 10 available / 1,963 sold",1963.0,"May 15, 2024 10:37:08 PDT","Hackensack, New Jersey, United States",Hombre
Giorgio Armani,Lot of 12 - Acqua Di Gio Profondo - Men's Luxury Cologne Samples - EDP - Armani,Eau de Parfum,24.0,US $24.00,3.0,3 available / 2 sold,2.0,No Especificado,"Arlington Heights, Illinois, United States",Hombre
Diesel,D By Diesel by Diesel Eau De Toilette Spray 3.4oz/100ml for Men WITHOUT BOX,Eau de Toilette,26.99,US $26.99,8.0,8 available / 21 sold,21.0,"May 17, 2024 11:34:20 PDT","Bogota, New Jersey, United States",Hombre
Dvyne Fragrances,Assorted Body Oils - 100% Pure Uncut Fragrances - 1/3 Oz Roll-Ons For Men,Body Oil,8.0,US $8.00/ea,10.0,"More than 10 available / 1,113 sold",1113.0,"May 22, 2024 08:22:07 PDT","Fort Lauderdale, Florida, United States",Hombre
Parfums de Marly,PDM PARFUMS DE MARLY LAYTON EXCLUSIF 1.5ml .05fl oz x 1 COLOGNE SPRAY SAMPLE,Parfum,12.0,US $12.00,10.0,More than 10 available / 19 sold,19.0,No Especificado,"Albany, New York, United States",Hombre
Afnan,Supremacy Incense by Afnan cologne for men EDP 3.3 / 3.4 oz New in Box,Eau de Perfume,24.35,US $24.35/ea,110.0,110 available / 692 sold,692.0,"May 21, 2024 23:18:09 PDT","Dallas, Texas, United States",Hombre
Lapidus,LAPIDUS pour Homme by Ted Lapidus Cologne 3.3 oz EDT 3.4 Men New in Box,Eau de Toilette,20.08,US $20.08/ea,29.0,29 available / 518 sold,518.0,"Apr 23, 2024 03:57:22 PDT","Dallas, Texas, United States",Hombre
Arabian Oud,Arabian Oud - Arabian Knight EDP For Men 3.4 oz/100ML,Fragrances,99.63,US $99.63,3.0,3 available / 13 sold,13.0,"May 22, 2024 09:26:42 PDT","Brooklyn, New York, United States",Hombre
Emporio Armani,Emporio Armani Stronger With You ABSOLUTELY 1.7oz.Parfum Spray New in Sealed Box,Perfume,74.99,US $74.99/ea,10.0,10 available / 82 sold,82.0,"May 23, 2024 05:39:50 PDT","Katy, Texas, United States",Hombre
Armaf,Hunter by Armaf cologne for men EDP 3.3 / 3.4 oz New in Box,Eau de Parfum,23.62,US $23.62/ea,130.0,130 available / 415 sold,415.0,"May 22, 2024 09:23:27 PDT","Dallas, Texas, United States",Hombre
Perry Ellis,360 Red by Perry Ellis 6.7 / 6.8 oz EDT Cologne for Men New In Box,Eau de Toilette,40.13,US $40.13,9.0,"9 available / 2,703 sold",2703.0,"May 22, 2024 15:05:34 PDT","Hackensack, New Jersey, United States",Hombre
Ralph Lauren,Polo Black by Ralph Lauren EDT 2.5 oz - 75 ml *NEW IN SEALED BOX*,Eau de Toilette,28.99,US $28.99,10.0,More than 10 available / 180 sold,180.0,"Mar 18, 2024 09:08:20 PDT","Miami, Florida, United States",Hombre
Zara,ZARA  8.0 SUMMER Eau Dau Toilette 100 ML,Eau de Toilette,15.0,US $15.00,2.0,2 available / 3 sold,3.0,"May 09, 2024 21:13:54 PDT","Houston, Texas, United States",Hombre
David Beckham,David Beckham The Essence Man 75ml Boxed,Eau de Toilette,37.0,C $37.00,10.0,More than 10 available / 60 sold,60.0,"May 21, 2024 07:32:36 PDT","Scarborough, Ontario, Canada",Hombre
Al Haramain,L'aventure Intense by Al Haramain for men EDP 3.4 oz New in Box,Eau de Parfum,31.98,US $31.98,10.0,More than 10 available / 12 sold,12.0,"May 23, 2024 11:09:04 PDT","North Brunswick, New Jersey, United States",Hombre
Rasasi,RASASI Hawas Ice For Men EDP - 100Ml (3.4Oz),Eau de Parfum,78.0,US $78.00,6.0,6 available / 27 sold,27.0,"May 20, 2024 13:03:25 PDT","Astoria, New York, United States",Hombre
Sterling,"Club De Nuit Intense by Armaf, 6.8 oz EDP Spray for Men",Eau De Parfum,53.42,US $53.42/ea,10.0,More than 10 available / 4 sold,4.0,"May 24, 2024 08:49:52 PDT","Edison, New Jersey, United States",Hombre
Falic Fashion Group,"Perry Ellis for Men 5.0 oz/150 ml Eau de Toilette Spray Men, Discontinued!",Eau de Toilette,29.98,US $29.98/ea,7.0,7 available / 14 sold,14.0,"May 05, 2024 09:23:49 PDT","Burlington, Ontario, Canada",Hombre
HUGO BOSS,BOSS THE SCENT by HUGO BOSS Cologne for Men edt 3.3 oz 3.4 tester,Eau de Toilette,47.26,US $47.26/ea,88.0,88 available / 52 sold,52.0,"May 09, 2024 11:34:50 PDT","Dallas, Texas, United States",Hombre
Giorgio Armani,Emporio Armani Stronger With You Intensely 3.3oz EDP Spray for Men in Sealed Box,Eau de Parfum,94.99,US $94.99/ea,10.0,10 available / 420 sold,420.0,"May 23, 2024 23:31:35 PDT","Katy, Texas, United States",Hombre
Prada,"Prada Luna Rossa Carbon by Prada, 3.4 oz EDT Spray for Men",Eau De Toilette,76.65,US $76.65/ea,10.0,More than 10 available / 30 sold,30.0,"May 23, 2024 08:58:49 PDT","Edison, New Jersey, United States",Hombre
Diesel,Diesel Fuel For Life for MEN Cologne 2.5 oz edt Spray NEW IN BOX,Eau de Toilette,29.74,US $29.74/ea,19.0,19 available / 578 sold,578.0,"May 16, 2024 21:09:42 PDT","Dallas, Texas, United States",Hombre
Jimmy Choo,Jimmy Choo Man Intense 3.3 / 3.4 oz EDT Cologne for Men Tester,Eau de Toilette,36.99,US $36.99,4.0,4 available / 16 sold,16.0,"May 23, 2024 20:57:06 PDT","Melissa, Texas, United States",Hombre
Michel Germain,Sexual pour homme by Michel Germain cologne EDT 4.2 oz New in Box,Eau de Toilette,41.19,US $41.19/ea,21.0,21 available / 258 sold,258.0,"May 24, 2024 09:22:09 PDT","Dallas, Texas, United States",Hombre
Gianni Versace,"NEW Versace Eros , Gianni Versace 6.7oz 200ml EDT Cologne for Men SEALED GENUINE",Eau de Toilette,69.25,US $69.25,3.0,3 available / 19 sold,19.0,"May 22, 2024 04:50:01 PDT","Selinsgrove, Pennsylvania, United States",Hombre
Lalique,Lalique by Lalique cologne for men EDP 4.2 oz New in Box,Eau de Parfum,31.47,US $31.47/ea,48.0,48 available / 397 sold,397.0,"Apr 24, 2024 22:58:09 PDT","Dallas, Texas, United States",Hombre
The Baron,The Baron For Gentleman Cologne Natural Atomizer 4.5 FL OZ NEW,Eau de Cologne,34.99,US $34.99,3.0,3 available / 1 sold,1.0,"Nov 12, 2023 12:18:20 PST","Canton, Michigan, United States",Hombre
Jean Paul Gaultier,Scandal Cologne by Jean Paul Gaultier 3.4 oz. EDT Pour Homme Spray NO BOX,Eau de Toilette,55.99,US $55.99/ea,10.0,10 available / 368 sold,368.0,"May 22, 2024 14:25:46 PDT","Katy, Texas, United States",Hombre
Liz Claiborne,Candie's Man by Liz Claiborne 3.4 oz EDT Cologne for Men New In Box,Eau de Toilette,18.32,US $18.32/ea,10.0,More than 10 available / 211 sold,211.0,"May 22, 2024 17:14:56 PDT","Hackensack, New Jersey, United States",Hombre
Nina Ricci,Signoricci for Men by Nina Ricci EDT Splash1.7 fl oz New Sealed Box.Vintage.Rare,Eau de Toilette,120.0,US $120.00/ea,3.0,3 available / 7 sold,7.0,"May 14, 2024 13:13:29 PDT","Argyle, Texas, United States",Hombre
Vince Camuto,Vince Camuto Virtu by Vince Camuto 3.4 oz EDT Cologne for Men Brand New Tester,Eau de Toilette,21.21,US $21.21/ea,8.0,8 available / 300 sold,300.0,"May 14, 2024 16:12:02 PDT","Hackensack, New Jersey, United States",Hombre
Givenchy,Givenchy Gentleman Reserve Privee 3.3 oz Eau de Parfum Spray for Men. Sealed Box,Eau de Parfum,80.0,US $80.00/ea,10.0,10 available / 197 sold,197.0,"May 24, 2024 03:20:57 PDT","Katy, Texas, United States",Hombre
Cartier,Declaration Haute Fraicheur by Cartier 3.3 oz EDT Cologne for Men Tester,Eau de Toilette,49.52,US $49.52,10.0,More than 10 available / 20 sold,20.0,"May 11, 2024 20:45:30 PDT","Hackensack, New Jersey, United States",Hombre
Dolce&Gabbana,Light Blue by Dolce & Gabbana D&G 6.7 oz EDT Cologne for Men New In Box,Eau de Toilette,54.99,US $54.99/ea,2.0,2 available / 45 sold,45.0,"Oct 20, 2022 18:26:14 PDT","Bellaire, Texas, United States",Hombre
Dolce&Gabbana,"Dolce & Gabbana ""K (KING) INTENSE"",3.3oz, Men, EDP, Spray,2024, Sealed",Eau de Parfum,91.0,US $91.00,3.0,3 available / 1 sold,1.0,"May 02, 2024 19:37:12 PDT","Manor, Texas, United States",Hombre
BRUT,Original Fragrance Cologne by Brut for Men - 5 oz Cologne,Eau de Cologne,9.78,US $9.78,50.0,50 available / 8 sold,8.0,"May 23, 2024 13:21:23 PDT","Ronkonkoma, New York, United States",Hombre
Maison Margiela,Replica Sailing Day by Maison Margiela 3.4 oz EDT Perfume Cologne New In Box,Eau de Toilette,84.98,US $84.98,8.0,8 available / 42 sold,42.0,"May 21, 2024 07:56:03 PDT","Hackensack, New Jersey, United States",Hombre
Mercedes Benz,"Mercedes Benz Intense by Mercedes Benz, 4 oz EDT Spray for Men",Eau De Toilette,41.87,US $41.87/ea,8.0,8 available / 21 sold,21.0,"May 23, 2024 08:57:02 PDT","Edison, New Jersey, United States",Hombre
Unbranded,VERSE ADONIS Pour Homme cologne for men 3.4oz,Eau de Parfum,13.99,US $13.99,10.0,More than 10 available / 9 sold,9.0,"Apr 28, 2024 20:19:23 PDT","Dearborn, Michigan, United States",Hombre
Carolina Herrera,Bad Boy Le Parfum by Carolina Herrera 3.4 oz. EDP Spray for Men New NO BOX,Eau de Parfum,59.99,US $59.99/ea,10.0,10 available / 496 sold,496.0,"May 19, 2024 16:41:48 PDT","Katy, Texas, United States",Hombre
Hollister,Hollister Festival Vibes 3.4 oz EDT Cologne for Men Brand New In Box,Eau de Toilette,18.76,US $18.76/ea,5.0,5 available / 227 sold,227.0,"May 20, 2024 20:39:02 PDT","Hackensack, New Jersey, United States",Hombre
Juicy Couture,Dirty English by Juicy Couture EDT Cologne for Men 3.4 oz New In Box,Eau de Toilette,22.6,US $22.60/ea,9.0,9 available / 541 sold,541.0,"May 24, 2024 07:10:03 PDT","Hackensack, New Jersey, United States",Hombre
Polo Ralph Lauren,Polo Blue by Ralph Lauren EDT Spray 4.2 oz for men Factory Sealed in Box,Eau de Toilette,33.0,US $33.00/ea,4.0,4 available / 401 sold,401.0,"May 23, 2024 05:29:20 PDT","Chico, California, United States",Hombre
Cuba,Cuba Brazil By Cuba cologne for men EDT 3.3 / 3.4 oz New in Box,Eau de Toilette,10.58,US $10.58/ea,31.0,31 available / 391 sold,391.0,"May 23, 2024 18:45:09 PDT","Dallas, Texas, United States",Hombre
Michael Jordan,Michael Jordan by Michael Jordan 3.4 oz Cologne Spray for Men New In Box,Eau de Cologne,20.48,US $20.48/ea,0.0,"Limited quantity available / 2,624 sold",2624.0,"May 22, 2024 21:41:09 PDT","Hackensack, New Jersey, United States",Hombre
Yves de Sistelle,Thallium Anonymous by Yves de Sistelle Cologne Men EDT 3.3 / 3.4 oz New In Box,Eau de Toilette,18.84,US $18.84/ea,47.0,47 available / 674 sold,674.0,"May 21, 2024 07:27:08 PDT","Dallas, Texas, United States",Hombre
Perry Ellis,"Perry Ellis 360 Red by Perry Ellis, 6.8 oz EDT Spray for Men",Eau De Toilette,40.72,US $40.72/ea,10.0,More than 10 available / 232 sold,232.0,"May 24, 2024 07:58:54 PDT","Edison, New Jersey, United States",Hombre
Givenchy,Gentleman Boisee by Givenchy cologne for men EDP 3.3 / 3.4 oz New in Box,Eau de Parfum,73.52,US $73.52/ea,4.0,4 available / 8 sold,8.0,"May 08, 2024 06:01:12 PDT","Dallas, Texas, United States",Hombre
Mandarin Duck,Mandarina Duck Black 3.4oz EDT Spray For Men New Choose Your Box (Regular/TSTR),Eau de Toilette,27.99,US $27.99/ea,10.0,More than 10 available / 75 sold,75.0,"Nov 02, 2022 03:03:01 PDT","Edison, New Jersey, United States",Hombre
Franck Olivier,Blue Touch By Franck Olivier Men Cologne 3.3oz 100ml Edt New,Eau de Toilette,24.25,US $24.25,10.0,More than 10 available / 177 sold,177.0,"May 22, 2024 12:42:51 PDT","North Brunswick, New Jersey, United States",Hombre
Dolce&Gabbana,Dolce & Gabbana Cologne For Men Eau De Toilette Spray 2.5oz./75ml **NIB**,Eau de Toilette,27.99,US $27.99/ea,7.0,7 available / 24 sold,24.0,No Especificado,"Des Moines, Iowa, United States",Hombre
GUESS,Guess 1981 by Guess cologne for men EDT 3.3 / 3.4 oz New in Box,Eau de Toilette,20.28,US $20.28/ea,45.0,"45 available / 1,613 sold",1613.0,"May 24, 2024 08:14:07 PDT","Dallas, Texas, United States",Hombre
Armaf,Club de Nuit Intense by Armaf cologne for men EDT 3.6 oz New in Box,Eau de Toilette,30.58,US $30.58,10.0,More than 10 available / 31 sold,31.0,"May 23, 2024 08:39:30 PDT",United States,Hombre
Paco Rabanne,Invictus by Paco Rabanne for Men EDT Spray 3.4 oz / 100 ml New In Box,Eau de Toilette,39.99,US $39.99/ea,2.0,2 available / 305 sold,305.0,"May 23, 2024 15:27:18 PDT","Jamaica, New York, United States",Hombre
Lomani,"Lomani EDT Cologne 3.4 oz Men - Authentic, Brand New In Box",Eau de Toilette,9.99,US $9.99/ea,2.0,2 available / 22 sold,22.0,"May 20, 2024 13:20:54 PDT","Lincoln Park, Michigan, United States",Hombre
Estee Lauder,"Beyond Paradise by Estee Lauder for Men Cologne Spray EDT 0.5 oz , New",Cologne spray,17.49,US $17.49/ea,10.0,More than 10 available / 24 sold,24.0,"Feb 28, 2024 07:27:01 PST","Keyport, New Jersey, United States",Hombre
Carolina Herrera,Good Girl by Carolina Herrera 2.7 oz Eau De Parfum Spray Women's New & Sealed,Eau de Parfum,43.99,US $43.99/ea,2.0,2 available / 393 sold,393.0,"May 23, 2024 10:43:50 PDT","Thomasville, Alabama, United States",Mujer
As Shown,Parfums de Marly Delina La Rosee Eau de Parfum 2.5 Fl Oz/75ml Spray for Women,Eau de Parfum,79.99,US $79.99,5.0,5 available / 40 sold,40.0,"May 24, 2024 00:15:48 PDT","New Jersey, Hong Kong",Mujer
PRADA,PRADA Paradoxe by Prada EDP 3.0oz/90ml Spray Perfume for Women New In Box,Eau de Parfum,59.99,US $59.99,10.0,More than 10 available / 35 sold,35.0,"May 14, 2024 20:54:25 PDT","Orange, New Jersey, United States",Mujer
As Show,J'adore Parfum D'eau by Christian 3.4 oz EDP Fragrance for Women New In Box,Eau de Parfum,59.99,US $59.99/ea,10.0,More than 10 available / 9 sold,9.0,"May 23, 2024 01:23:05 PDT","USA, New Jersey, Hong Kong",Mujer
Khadlaj,"Shiyaaka for Men EDP Spray 100ML (3.4 FL.OZ) By Khadlaj (Woody, Aromatic, Earth)",Eau de Parfum,29.99,US $29.99/ea,10.0,More than 10 available,0.0,No Especificado,"Little Ferry, New Jersey, United States",Mujer
Viktor & Rolf,Flowerbomb by Viktor & Rolf 3.4 oz 100ML Eau De Parfum Brand New Sealed In Box,Eau de Parfum,51.99,US $51.99/ea,8.0,8 available / 184 sold,184.0,"May 23, 2024 10:44:09 PDT","Warren, Michigan, United States",Mujer
AS SHOW,PRADA Paradoxe by Prada EDP 3.0oz/90ml Spray Perfume for Women New In Box US,Eau de Parfum,58.99,US $58.99,0.0,Out of Stock / 18 sold,18.0,"May 24, 2024 00:15:13 PDT","Astoria, New York, United States",Mujer
Versace,Versace Bright Crystal Women EDT 6.7 oz 200 ml New Sealed in Box,Eau de Toilette,52.79,US $52.79/ea,6.0,6 available / 258 sold,258.0,"May 21, 2024 06:41:13 PDT","Dexter, Michigan, United States",Mujer
Versace,Versace Bright Crystal by Versace for Women EDT Spray 3.0 oz / 90 ml New In Box,Eau de Toilette,29.99,US $29.99,0.0,Last One / 251 sold,251.0,"May 23, 2024 22:39:02 PDT","Jamaica, New York, United States",Mujer
Lattafa,Fakhar by Lattafa Eau de Parfum 3.4 oz / 100 ml Spray for Men,Eau de Parfum,22.75,US $22.75/ea,10.0,More than 10 available / 174 sold,174.0,"May 24, 2024 00:25:04 PDT","New York, New York, United States",Mujer
Yves Saint Laurent,Yves Saint Laurent Black Opium 3oz Eau de Parfum Women's New Sealed,Eau de Parfum,39.99,US $39.99/ea,10.0,More than 10 available / 77 sold,77.0,"May 24, 2024 11:01:13 PDT","Ecorse, Michigan, United States",Mujer
Gucci,Gucci Bloom 3.3oz / 3.4oz Eau de Parfum Women's Fragrance New Sealed,Eau de Parfum,64.99,US $64.99/ea,10.0,More than 10 available / 35 sold,35.0,"May 24, 2024 11:01:04 PDT","Ecorse, Michigan, United States",Mujer
Carolina Herrera,Very Good Girl GLAM by Carolina Herrera 2.7 oz Eau de parfum Spray New & Sealed,Eau de Parfum,60.99,US $60.99/ea,2.0,2 available / 51 sold,51.0,"May 23, 2024 16:56:32 PDT","Quinlan, Texas, United States",Mujer
Carolina Herrera,Good Girl by Carolina Herrera 2.7 fl oz Spray Eau De Parfum New & Sealed,Eau de Parfum,43.49,US $43.49/ea,2.0,2 available / 20 sold,20.0,"May 22, 2024 10:25:36 PDT","Cincinnati, Ohio, United States",Mujer
Coach,Coach Floral 3.0 oz EDP eau de parfum spray womens perfume 90ml Tester,Eau de Parfum,29.2,US $29.20/ea,10.0,More than 10 available / 505 sold,505.0,"May 08, 2024 09:46:06 PDT","Edison, New Jersey, United States",Mujer
Guerlain,Guerlain NEROLI OUTRENOIR Eau de Parfum 2ml /.06oz Sample Spray NIB,Eau de Parfum,13.0,US $13.00,10.0,More than 10 available / 94 sold,94.0,"May 24, 2024 09:43:51 PDT","New York, New York, United States",Mujer
Philosophy,"Amazing Grace by Philosophy, 4 oz EDP Intense Spray for Women",Eau De Parfum,39.69,US $39.69/ea,10.0,More than 10 available / 234 sold,234.0,"May 24, 2024 10:21:14 PDT","Edison, New Jersey, United States",Mujer
Marc Jacobs,Marc Jacobs Decadence For Women by Marc Jacobs 3.4 oz 100ml EDP Spray New,Eau de Parfum,59.99,US $59.99,6.0,6 available / 34 sold,34.0,"May 22, 2024 18:32:01 PDT","New York,USA, Hong Kong",Mujer
AS SHOWN,PRADA Paradoxe By Prada EDP 3.0oz/90ml Spray Perfume For Women New In Box USA,Eau de Parfum,59.99,US $59.99,0.0,Last One / 43 sold,43.0,"May 23, 2024 01:10:19 PDT","New York, New York, United States",Mujer
Dolce & Gabbana,D&G DOLCE & GABBANA LIGHT BLUE EAU INTENSE WOMEN 1.5ml .05oz x 5 PERFUME SAMPLES,Eau de Parfum,11.0,US $11.00,10.0,"More than 10 available / 1,613 sold",1613.0,"Apr 05, 2024 00:52:19 PDT","Albany, New York, United States",Mujer
QRC,Oxytocin-N 15iu Per Spray 1oz (30ml),Spray,27.0,US $27.00/ea,10.0,More than 10 available / 218 sold,218.0,"Mar 20, 2024 12:14:58 PDT","Oklahoma City, Oklahoma, United States",Mujer
~ CREPE ERASE ~,CREPE ERASE-BODY FIRM ADVANCED BODY REPAIR TREATMENT ULTR- 3.3 OZ  Sealed W/OBox,~ BODY FIRM ADVANCED BODY REPAIR TREATMENT ~,29.99,US $29.99,10.0,More than 10 available / 1 sold,1.0,No Especificado,"Melrose Park, Illinois, United States",Mujer
Unbranded,Lattafa YARA by Lattafa 3.4 Oz (100 ml) EDP Eau De Parfum Spray for Women.,Eau de Parfum,16.27,US $16.27/ea,300.0,300 available / 38 sold,38.0,"May 24, 2024 08:20:15 PDT","shanghai, China",Mujer
YSL,Libre by Yves Saint Laurent YSL 3 oz EDP Perfume for Women New in Box,Eau de Parfum,54.95,US $54.95,0.0,Last One / 25 sold,25.0,"May 24, 2024 00:08:02 PDT","Stuyvesant Falls, New York, United States",Mujer
Carolina Herrera,Carolina Herrera Good Girl 2.7 oz EDP Feminine & Empowering New,Eau de Parfum,49.99,US $49.99/ea,6.0,6 available / 183 sold,183.0,"May 23, 2024 09:40:39 PDT","Macomb, Michigan, United States",Mujer
Parfums de Marly,Parfums de Marly Delina 2.5 oz/75 ml EDP Spray for Women New With Sealed Box,Eau de Parfum,84.99,US $84.99,4.0,4 available / 71 sold,71.0,"May 22, 2024 01:30:45 PDT","California or Hong Kong, Hong Kong",Mujer
Yves Saint Laurent,Mon Paris 3 oz Perfume by Yves Saint Laurent 90 ml Womens Spray EDP New & Sealed,Eau de Parfum,39.99,US $39.99/ea,8.0,8 available / 126 sold,126.0,"May 24, 2024 05:51:11 PDT","Farmington, Michigan, United States",Mujer
Dolce&Gabbana,Dolce & Gabbana Light Blue 6.7 oz Spray Eau De Toilette Women's New & Sealed,Eau de Toilette,53.99,US $53.99,0.0,Out of Stock / 54 sold,54.0,"May 24, 2024 03:14:29 PDT","Ecorse, Michigan, United States",Mujer
EX NIHILO,Blue Taliman by Ex Nihilo Eau De Parfum 3.3oz/100ml Unisex Spray New With Box,Eau de Parfum,99.99,US $99.99,4.0,4 available / 29 sold,29.0,"May 23, 2024 03:50:04 PDT","California or Hong Kong, Hong Kong",Mujer
Juliette has a gun,Not a Perfume by Juliette has a gun 3.3 oz EDP Perfume for Women Tester,Eau de Parfum,40.92,US $40.92/ea,0.0,"Limited quantity available / 1,571 sold",1571.0,"May 24, 2024 07:32:36 PDT","Hackensack, New Jersey, United States",Mujer
Davidoff,Davidoff Cool Water Sea Rose Eau De Toilette Spray For Her 100 Ml NEW IN BOX,Eau de Toilette,22.9,US $22.90/ea,10.0,More than 10 available / 291 sold,291.0,"May 08, 2024 17:11:47 PDT","Princeton Junction, New Jersey, United States",Mujer
Viktor & Rolf,Viktor Rolf Flowerbomb 3.4 oz L'Eau De Parfum Spray New Factory Sealed in Box,Eau de Parfum,42.0,US $42.00/ea,4.0,4 available / 406 sold,406.0,"May 23, 2024 22:57:33 PDT","Portland, Oregon, United States",Mujer
Giorgi^o Armani,Sì Passione by Giorgio Armani For Women 3.4 Oz Eau De Parfum Spray New in Box,Eau de Parfum,44.88,US $44.88/ea,7.0,7 available / 147 sold,147.0,"May 20, 2024 00:21:18 PDT","South El Monte, California, United States",Mujer
PRADA,Prada Les infusions De Milano Iris Cedre for Women 3.4oz/100ml EDP Spray In Box,Eau de Parfum,66.99,US $66.99,10.0,More than 10 available / 3 sold,3.0,"May 23, 2024 18:00:47 PDT","Perth Amboy, New Jersey, United States",Mujer
Roja,Roja Parfums Isola Blu Parfum Unisex 50ml / 1.7oz New With Sealed Box,Eau de Parfum,129.99,US $129.99,5.0,5 available / 37 sold,37.0,"May 24, 2024 09:25:04 PDT","United States, Canada",Mujer
AS SHOWN,Perfume EDP for Women 3.4 oz / 100 ml Brand NEW,Eau de Parfum,22.99,US $22.99,10.0,10 available / 11 sold,11.0,"May 24, 2024 06:30:59 PDT","CA, China",Mujer
Parfums de Marly,PDM PARFUMS DE MARLY DELINA EXCLUSIF 1.5ml .05fl oz x 1 PERFUME SPRAY SAMPLE,Parfum,12.0,US $12.00,10.0,More than 10 available / 59 sold,59.0,No Especificado,"Albany, New York, United States",Mujer
Marc Jacobs,Marc Jacobs Daisy Eau So Fresh 4.2 oz / 125 mL Eau De Toilette Brand New Sealed,Eau de Toilette,32.95,US $32.95,10.0,More than 10 available / 68 sold,68.0,"May 17, 2024 04:50:31 PDT","College Point, New York, United States",Mujer
Ariana Grande,Cloud by Ariana Grande 3.4 oz / 100 ML EDP Perfume for Women New In Box Sealed,Eau de Parfum,31.05,US $31.05/ea,9.0,9 available / 54 sold,54.0,"May 23, 2024 21:28:14 PDT","Detroit, Michigan, United States",Mujer
Versace,Versace Dylan Turquoise by Gianni Versace for women EDT 3.3 / 3.4 oz New Tester,Eau de Toilette,32.2,US $32.20/ea,60.0,60 available / 157 sold,157.0,"May 17, 2024 06:09:15 PDT","Dallas, Texas, United States",Mujer
Sol De Janeiro,Sol de Janeiro Mini Brazilian Crush Body Fragrance Mist 3.04 oz/ 90 mL,Fragrance Mist,17.9,US $17.90/ea,10.0,More than 10 available / 4 sold,4.0,"May 21, 2024 19:47:36 PDT","Round Rock, Texas, United States",Mujer
Kilian,Love by Kilian Don't Be Shy Eau de Parfum 7.5 ml/0.25 fl. oz. Free Shipping …,Eau de Parfum,29.75,US $29.75,9.0,9 available / 80 sold,80.0,"May 24, 2024 09:49:39 PDT","Tulsa, Oklahoma, United States",Mujer
Donna Karan,Donna Karan CASHMERE MIST Deodorant-Anti-Perspirant Stick 1 OZ / 30mL NEW,Deodorant Stick,19.99,US $19.99/ea,10.0,More than 10 available / 441 sold,441.0,"May 20, 2024 11:47:05 PDT","Elizabeth, New Jersey, United States",Mujer
Carolina Herrera,Carolina Herrera Good Girl 2.7 oz Eau De Parfum Spray Women's New & Sealed,Eau de Parfum,43.99,US $43.99/ea,2.0,2 available / 16 sold,16.0,"May 24, 2024 02:41:54 PDT","San Jose, California, United States",Mujer
Carolina Herrera,Very Good Girl GLAM by Carolina Herrera 2.7 oz EDP Spray Women's New & Sealed.,Eau de Parfum,59.99,US $59.99/ea,2.0,2 available / 21 sold,21.0,"May 22, 2024 16:11:22 PDT","Cincinnati, Ohio, United States",Mujer
Marc Jacobs,Marc Jacobs Daisy Women's Eau De Toilette Spray For Women EDT 3.4Oz 100ml New,Eau de Toilette,42.88,US $42.88,10.0,More than 10 available / 71 sold,71.0,"May 19, 2024 22:27:54 PDT","College Point, New York, United States",Mujer
Parfums de Marly,PARFUMS de MARLY DELINA for WOMEN 2.5 oz (75ml) EDP Spray NEW SEALED  BOX,Eau de Parfum,100.99,US $100.99,0.0,Last One / 49 sold,49.0,"May 17, 2024 03:05:11 PDT","Buffalo Mills, Pennsylvania, United States",Mujer
Juliette has a gun,Juliette Has A Gun Discovery Kit includes LUST for sun SEALED new,Eau de Parfum,26.05,US $26.05/ea,10.0,More than 10 available / 128 sold,128.0,"May 19, 2024 15:38:07 PDT","Winter Garden, Florida, United States",Mujer
AS SHOWN,Flora Gorgeous Jasmine 3.3 oz / 100 ml EDP Perfume Spray for Women New In Box,Eau de Parfum,54.99,US $54.99/ea,5.0,5 available / 60 sold,60.0,"May 24, 2024 01:42:35 PDT","USA,California, Hong Kong",Mujer
