brand,title,type,price,priceWithCurrency,available,availableText,sold,lastUpdated,itemLocation,genero
Narciso Rodriguez,Bleu Noir by Narciso Rodriguez 3.3 3.4 oz EDP Cologne for Men New In Box,Eau de Parfum,59.09,US $59.09/ea,10.0,More than 10 available / 432 sold,432.0,"May 21, 2024 20:17:38 PDT","Hackensack, New Jersey, United States",Hombre
Burberry,"Burberry HERO For Men Eau de Toilette EDT Sample Spray .05oz, 1.5ml",Eau de Toilette,7.95,US $7.95,5.0,5 available / 254 sold,254.0,"May 24, 2024 00:33:04 PDT","Phillipsburg, New Jersey, United States",Hombre
Roja,Scandal by Roja Parfums 3.4 oz Eau De Parfum Cologne Spray for Men New in Box,Eau de Parfum,109.99,US $109.99/ea,8.0,8 available / 26 sold,26.0,"May 04, 2024 05:57:21 PDT","Rowland Heights, California, United States",Hombre
Paco Rabanne,Paco Rabanne Men's 1 Million Royal Parfum Spray 1.7 oz Fragrances 3349668617043,Fragrances,68.61,US $68.61,3.0,3 available / 10 sold,10.0,"May 23, 2024 13:26:47 PDT","Brooklyn, New York, United States",Hombre
Davidoff,Davidoff Cool Water All Over Body Spray 5 Oz / 150 ML NEW Damaged Can,Body Spray,12.49,US $12.49/ea,7.0,7 available / 17 sold,17.0,"May 15, 2024 11:28:53 PDT","Princeton, New Jersey, United States",Hombre
Emporio Armani,Emporio Armani Stronger With You by Giorgio Armani 3.4 oz Cologne for Men NIB,Eau de Toilette,71.98,US $71.98/ea,0.0,"Limited quantity available / 1,333 sold",1333.0,"May 21, 2024 15:07:29 PDT","Hackensack, New Jersey, United States",Hombre
Yves Saint Laurent,La Nuit De L'homme by Yves Saint Laurent YSL Cologne Men 3.3 3.4 oz New In Box,Eau de Toilette,70.65,US $70.65/ea,0.0,"Limited quantity available / 4,802 sold",4802.0,"May 24, 2024 07:41:02 PDT","Hackensack, New Jersey, United States",Hombre
Topshelf,Topshelf Love Bombed- Pheromone Cologne for Men Attraction & Confidence (50 ml),Perfume,139.99,US $139.99/ea,10.0,More than 10 available / 4 sold,4.0,"May 10, 2024 21:53:08 PDT","Houston, Texas, United States",Hombre
Carolina Herrera,212 MEN Carolina Herrera 3.4 oz EDT Cologne New Sealed,Eau de Toilette,39.99,US $39.99/ea,10.0,More than 10 available / 52 sold,52.0,"May 21, 2024 06:41:06 PDT","Dexter, Michigan, United States",Hombre
Jean Paul Gaultier,Jean Paul Gaultier Le Male Cologne EDT 4.2oz Iconic Masculine Fragrance Allure,Eau de Toilette,48.99,US $48.99/ea,10.0,More than 10 available / 30 sold,30.0,"May 24, 2024 07:13:17 PDT","Detroit, Michigan, United States",Hombre
Polo Ralph Lauren,Polo Blue by Ralph Lauren 4.2oz Men's Eau de Toilette Spray EDT New & Sealed Box,Eau de Toilette,33.99,US $33.99/ea,8.0,8 available / 89 sold,89.0,"May 24, 2024 05:53:37 PDT","Fenton, Michigan, United States",Hombre
Versace,Versace Dylan Blue pour homme cologne for men EDT 6.7 oz 6.8 New in Box,Eau de Toilette,66.39,US $66.39/ea,62.0,"62 available / 1,819 sold",1819.0,"May 24, 2024 10:12:08 PDT","Dallas, Texas, United States",Hombre
Davidoff,Cool Water by Davidoff 4.2 oz EDT Cologne for Men New In Box,Eau de Toilette,26.9,US $26.90,10.0,More than 10 available / 264 sold,264.0,"May 18, 2024 10:55:29 PDT","Centralia, Washington, United States",Hombre
Paco Rabanne,Invictus Paco Rabanne Made Stronger With Pheromones For Super Sexy Scent Trails!,Eau de Toilette,16.48,US $16.48,10.0,More than 10 available / 16 sold,16.0,"May 16, 2024 16:30:41 PDT","Austell, Georgia, United States",Hombre
Armaf,ARMAF CLUB DE NUIT INTENSE + MILESTONE + SILLAGE 1.0 oz 3PC SET + FREE SAMPLE,Eau de Parfum,65.0,US $65.00/ea,10.0,More than 10 available / 485 sold,485.0,"May 17, 2024 11:37:19 PDT","Houston, Texas, United States",Hombre
Carolina Herrera,Carolina Herrera 212 NYC Men's EDT 3.4 oz | Eau de Toilette Spray,Eau de Toilette,39.99,US $39.99/ea,10.0,More than 10 available / 19 sold,19.0,"May 10, 2024 10:59:33 PDT","Detroit, Michigan, United States",Hombre
Myrurgia,YACHT MAN DENSE by Myrurgia cologne EDT 3.3 / 3.4 oz New in Box,Eau de Toilette,9.21,US $9.21/ea,202.0,"202 available / 3,093 sold",3093.0,"May 02, 2024 01:30:50 PDT","Dallas, Texas, United States",Hombre
Brut,Brut Original EDT Cologne for Men 3.4 oz Brand New In Box,Eau de Toilette,13.89,US $13.89,9.0,9 available / 48 sold,48.0,"May 22, 2024 11:57:53 PDT","Hackensack, New Jersey, United States",Hombre
Armaf,Odyssey Mandarin Sky Limited Edition EDP Perfume By Armaf 100ML🥇Top Fragrance🥇,Eau de Parfum,45.0,US $45.00/ea,10.0,More than 10 available / 150 sold,150.0,"May 15, 2024 15:14:22 PDT","San Diego, California, United States",Hombre
Calvin Klein,CK ONE BY CALVIN KLEIN 3.4/3.3 OZ EDT SPRAY FOR UNISEX NEW IN NO BOX SAME AS PIC,Eau de Toilette,21.95,US $21.95/ea,3.0,3 available / 189 sold,189.0,"Apr 23, 2024 19:35:29 PDT","New York, New York, United States",Hombre
Penhaligon's,Portraits The Tragedy of Lord George By Penhaligon's EDP Spray 2.5oz/75ml,Eau de Parfum,71.99,US $71.99,5.0,5 available / 3 sold,3.0,"May 21, 2024 00:10:23 PDT","NewYork, Hong Kong",Hombre
Ed Hardy,Ed Hardy Hearts & Daggers 3.4 oz edt Cologne Spray for Men New in Box,Eau de Toilette,20.25,US $20.25/ea,311.0,"311 available / 6,633 sold",6633.0,"May 23, 2024 14:38:05 PDT","Dallas, Texas, United States",Hombre
Paco Rabanne,1 Million Men Cologne Handmade Stronger With Pheromones For Sexual Attraction!,Eau de Toilette,17.98,US $17.98,10.0,More than 10 available / 4 sold,4.0,"May 15, 2024 17:31:27 PDT","Austell, Georgia, United States",Hombre
Tommy Hilfiger,TOMMY by TOMMY HILFIGER Cologne for Men 0.5 oz Eau de Toilette Spray NEW AS PIC,Eau de Toilette,9.95,US $9.95/ea,5.0,5 available / 269 sold,269.0,"May 21, 2024 05:43:41 PDT"," Beauty Maxima, United States, United States",Hombre
Hollister,Hollister Jake Cologne Eau De Cologne 1.7 Oz/50 ml Ne🦋 Sealed Men,Eau de Cologne,28.97,US $28.97/ea,9.0,9 available / 12 sold,12.0,No Especificado,"Chesapeake, Virginia, United States",Hombre
J. Del Pozo,Halloween Man Hero by Jesus Del Pozo cologne EDT 4.2 oz New in Box,Eau de Toilette,28.11,US $28.11/ea,7.0,7 available / 542 sold,542.0,"May 24, 2024 08:33:10 PDT","Dallas, Texas, United States",Hombre
FM,New Frederic Malle CARNAL FLOWER Dominique Ropion MINI Travel Spray .12oz/3.5ml,Editions Parfums,16.85,US $16.85/ea,4.0,4 available / 16 sold,16.0,"May 20, 2024 06:43:11 PDT","Nashua, New Hampshire, United States",Hombre
Valentino,Valentino Uomo Born In Roma Coral Fantasy 3.4 oz EDT Cologne New In Box,Eau de Toilette,103.98,US $103.98,0.0,Limited quantity available / 350 sold,350.0,"May 22, 2024 16:56:40 PDT","Hackensack, New Jersey, United States",Hombre
Coach,Coach Green by Coach cologne for men EDT 3.3 /3.4  oz New Tester,Eau de Toilette,39.99,US $39.99/ea,13.0,13 available / 35 sold,35.0,"May 24, 2024 06:43:00 PDT","Melissa, Texas, United States",Hombre
Dior,DIOR HOMME COLOGNE EAU DE TOILETTE SPRAY 4.2 OZ / 125ML - READ DETAILS,DIOR HOMME COLOGNE,89.99,US $89.99,7.0,7 available / 129 sold,129.0,"May 22, 2024 09:17:01 PDT","Union, New Jersey, United States",Hombre
Paco Rabanne,Paco Rabanne Invictus Legend 5.1 FL OZ / 150 ML EAU DE PARFUM SPRAY - RARE ITEM,Eau de Parfum,140.0,US $140.00,0.0,Last One / 2 sold,2.0,No Especificado,"Franklin Square, New York, United States",Hombre
HUGO BOSS,Boss Bottled Infinite By Hugo Boss EDP For Men 3.3 oz / 100 ml *NEW*,Eau de Parfum,52.99,US $52.99,0.0,Last One / 7 sold,7.0,No Especificado,"Miami, Florida, United States",Hombre
Paris Hilton,PARIS HILTON edt Cologne Spray 3.4 oz 3.3 Men New in RETAIL Box,Eau de Toilette,25.49,US $25.49/ea,16.0,"16 available / 2,093 sold",2093.0,"May 13, 2024 19:01:09 PDT","Dallas, Texas, United States",Hombre
Dolce&Gabbana,Dolce & Gabbana Pour Homme 4.2 oz D&G Cologne for Men Tester with Cap,Eau de Toilette,33.37,US $33.37/ea,5.0,5 available / 400 sold,400.0,"May 23, 2024 11:42:30 PDT","Hackensack, New Jersey, United States",Hombre
Paco Rabanne,Invictus by Paco Rabanne 6.8 oz. Eau de Toilette Spray for Men. New. NO BOX,Eau de Toilette,64.99,US $64.99/ea,10.0,10 available / 313 sold,313.0,"May 24, 2024 01:41:58 PDT","Katy, Texas, United States",Hombre
Giorgio Armani,Armani Code By Giorgio Armani 4.2 oz Mens Eau de Toilette Spray NEW & SEALED BOX,Eau de Toilette,39.99,US $39.99/ea,8.0,8 available / 26 sold,26.0,"May 23, 2024 10:39:37 PDT","Sterrett, Alabama, United States",Hombre
Kenneth Cole,KENNETH COLE BLACK Cologne for Men 3.4 oz EDT Spray New in Box,Eau de Toilette,24.15,US $24.15/ea,10.0,More than 10 available / 14 sold,14.0,No Especificado,"Miami, Florida, United States",Hombre
Unbranded,Armaf Club de Nuit ICONIC 3.6 fl.oz Eau de Parfum | Armaf's Exclusive New Launch,Perfume,35.99,US $35.99,5.0,5 available / 27 sold,27.0,"May 23, 2024 20:05:31 PDT","Shenzhen, China",Hombre
Calvin Klein,Ck One by Calvin Klein Cologne Perfume Unisex 3.4 oz New In Box US STOCK,Eau de Parfum,21.27,US $21.27/ea,10.0,More than 10 available / 30 sold,30.0,"May 09, 2024 20:48:12 PDT","Rowland Heights, California, United States",Hombre
John Varvatos,John Varvatos Oud 4.1/4.1 oz Eau De Parfum 100 ml Spray For Men,Eau de Parfum,79.99,US $79.99/ea,10.0,More than 10 available / 17 sold,17.0,"May 10, 2024 17:42:19 PDT","El Cajon, California, United States",Hombre
Dolce&Gabbana,Dolce & Gabbana Light Blue Men Cologne EDT 4.2oz Crisp Oceanic Scent Breeze,Eau de Toilette,29.99,US $29.99/ea,6.0,6 available / 10 sold,10.0,"May 24, 2024 07:13:43 PDT","Detroit, Michigan, United States",Hombre
Giorgio Armani,Giorgio Armani Code Men 4.2oz EDT Designer Fragrance Spray Elegant Sealed New,Eau de Toilette,38.25,US $38.25/ea,5.0,5 available / 8 sold,8.0,"May 23, 2024 07:48:48 PDT","Romulus, Michigan, United States",Hombre
As Show,Fahrenheit Eau De Toilette 3.4 oz/100 ml EDT Cologne Spray for Men New in Box,Eau de Toilette,49.99,US $49.99/ea,20.0,20 available / 15 sold,15.0,"May 24, 2024 02:29:59 PDT","Dayton,New Jersey, Hong Kong",Hombre
Heaven Scents,Taj Perfume 100 ML by Heaven Scents Arabian Fragrance made in Dubai  Perfuma,Perfume,139.99,US $139.99/ea,4.0,4 available / 46 sold,46.0,"May 11, 2024 15:09:30 PDT","Bridgeview, Illinois, United States",Hombre
Abercrombie & Fitch,Fierce By Abercrombie & Fitch 6.7oz/200ml Men's Eau De Cologne Brand New ~Sealed,Eau de Cologne,49.49,US $49.49/ea,10.0,More than 10 available / 463 sold,463.0,"May 23, 2024 08:07:45 PDT","Detroit, Michigan, United States",Hombre
Sean John,Sean John I Am King EDT Cologne Spray for Men 3.4 oz - New in Box,Eau de Toilette,24.99,US $24.99/ea,10.0,More than 10 available / 116 sold,116.0,"May 24, 2024 04:29:16 PDT","Miami, Florida, United States",Hombre
Ralph Lauren,Polo Cologne Intense by Ralph Lauren for men EDC 8.0 oz New in Box,Eau de Cologne,53.99,US $53.99/ea,129.0,129 available / 229 sold,229.0,"May 24, 2024 06:09:16 PDT","Dallas, Texas, United States",Hombre
Gucci,Gucci Guilty Pour Homme by Gucci cologne EDP 3.0 oz New Tester,Eau de Parfum,68.99,US $68.99/ea,8.0,8 available / 248 sold,248.0,"May 17, 2024 12:14:48 PDT","Dallas, Texas, United States",Hombre
Coach,Coach Blue 3.3 oz EDT eau de toilette spray Mens Cologne 100 ml NEW Tester,Eau de Toilette,29.99,US $29.99/ea,10.0,More than 10 available / 286 sold,286.0,"May 15, 2024 11:50:00 PDT","Edison, New Jersey, United States",Hombre
SECERTMU,"50ML Savagery Pheromone Men Perfume, Pheromone Cologne for Men Attract Women",Perfume,11.99,US $11.99/ea,10.0,More than 10 available / 51 sold,51.0,"May 18, 2024 15:24:03 PDT","Los Angeles, California, United States",Hombre
Coach,Coach Green by Coach cologne for men EDT 3.3 /3.4  oz New Tester,Eau de Toilette,41.99,US $41.99/ea,15.0,15 available / 248 sold,248.0,"May 24, 2024 07:21:29 PDT","Dallas, Texas, United States",Hombre
Yves Saint Laurent,Yves Saint Laurent L'Homme 3.3 oz Men's Eau de Parfum,Eau de Parfum,84.59,US $84.59,3.0,3 available / 19 sold,19.0,"May 23, 2024 22:26:34 PDT","Brooklyn, New York, United States",Hombre
Valentino,Valentino Uomo Born In Roma 3.4.Oz /100ML Eau De Toilette Spray for Men,Eau de Toilette,75.99,US $75.99/ea,2.0,2 available / 8 sold,8.0,"May 24, 2024 00:48:30 PDT","Walnut, California, Hong Kong",Hombre
Carolina Herrera,212 MEN NYC by Carolina Herrera 3.4 fl oz EDT Cologne for Men New in Box,Eau de Toilette,39.99,US $39.99/ea,10.0,More than 10 available / 207 sold,207.0,"May 23, 2024 08:07:32 PDT","Lincoln Park, Michigan, United States",Hombre
HERMÈS,Terre D'Hermes by Hermes cologne for men EDT 3.3 / 3.4 oz New in Box,Eau de Toilette,64.88,US $64.88/ea,16.0,16 available / 292 sold,292.0,"May 20, 2024 18:27:48 PDT","Dallas, Texas, United States",Hombre
Paco Rabanne,Paco Rabanne 1 Million 3.4 oz Men's EDT Bold Signature Scent New,Eau de Toilette,49.99,US $49.99/ea,5.0,5 available / 21 sold,21.0,"May 18, 2024 08:34:44 PDT","Macomb, Michigan, United States",Hombre
Tommy Bahama,Maritime Deep Blue by Tommy Bahama 4.2 oz Cologne for Men New in Box,Eau de Cologne,32.62,US $32.62/ea,10.0,More than 10 available / 242 sold,242.0,"May 23, 2024 09:27:28 PDT","Hackensack, New Jersey, United States",Hombre
Polo Ralph Lauren,Polo Ralph Lauren 4.0 oz Cologne Intense Spray for Men 118 ml NIB,Eau de Parfum,37.59,US $37.59/ea,10.0,More than 10 available / 78 sold,78.0,"Apr 12, 2024 09:33:58 PDT","Edison, New Jersey, United States",Hombre
Ralph Lauren,Polo Red by Ralph Lauren 4.2 oz EDT Cologne for Men Brand New,Eau de Toilette,29.46,US $29.46,10.0,More than 10 available / 43 sold,43.0,"May 22, 2024 10:10:03 PDT","Hackensack, New Jersey, United States",Hombre
Karl Lagerfeld,Lagerfeld Classic by Lagerfeld 5 oz EDT Cologne for Men New In Box,Eau de Toilette,25.1,US $25.10/ea,0.0,"Limited quantity available / 5,076 sold",5076.0,"May 22, 2024 18:19:59 PDT","Hackensack, New Jersey, United States",Hombre
Giorgio Armani,Giorgio Armani Aqua Di Gio Men's 3.4 oz EDT Classic Scent Brand New,Eau de Toilette,29.99,US $29.99/ea,9.0,9 available / 6 sold,6.0,"May 24, 2024 05:51:42 PDT","Warren, Michigan, United States",Hombre
Ralph Lauren,Polo Blue by Ralph Lauren Cologne for Men 4.2 oz Brand New,Eau de Toilette,31.99,US $31.99,9.0,9 available / 35 sold,35.0,"May 24, 2024 02:00:07 PDT","Hackensack, New Jersey, United States",Hombre
Lacoste,L'homme Lacoste Intense by Lacoste cologne EDT 3.3 / 3.4 oz New in Box,Eau de Toilette,32.5,US $32.50/ea,40.0,40 available / 634 sold,634.0,"May 10, 2024 10:21:09 PDT","Dallas, Texas, United States",Hombre
Giorgio Armani,Armani Acqua Di Gio 6.7 oz Men's EDT Iconic Aquatic Fragrance Sealed,Eau de Toilette,48.95,US $48.95/ea,6.0,6 available / 40 sold,40.0,"May 22, 2024 10:16:51 PDT","Fourmile, Kentucky, United States",Hombre
Paco Rabanne,Phantom by Paco Rabanne 5.1 oz EDT Refillable Cologne for Men Brand New In Box,Eau de Toilette,84.6,US $84.60/ea,0.0,Limited quantity available / 111 sold,111.0,"May 22, 2024 11:53:06 PDT","Hackensack, New Jersey, United States",Hombre
Lalique,Lalique Pour Homme Lion / Lalique EDP Spray 4.2 oz (m),Eau de Parfum,27.25,US $27.25,3.0,3 available / 24 sold,24.0,"May 22, 2024 11:50:35 PDT","Brooklyn, New York, United States",Hombre
Giorgio Armani,Giorgio Armani Acqua Di Gio 3.4 oz Men's Eau de Toilette Spray brand new.,Eau de Toilette,27.5,US $27.50/ea,3.0,3 available / 18 sold,18.0,"May 22, 2024 12:46:11 PDT","Warren, Michigan, United States",Hombre
Afnan,Afnan Men's Modest Une Pour Homme EDP Spray 3.4 oz Fragrances 6290171001966,Eau de Parfum,24.43,US $24.43,3.0,3 available / 16 sold,16.0,"May 23, 2024 09:08:51 PDT","Brooklyn, New York, United States",Hombre
Giorgio Armani,Giorgio Armani Acqua Di Gio Parfum 4.2 oz / 125 ml Refillable Spray For Men,Parfum,128.99,US $128.99/ea,10.0,More than 10 available / 9 sold,9.0,"May 21, 2024 16:16:24 PDT","New York, New York, United States",Hombre
Guy Laroche,"Drakkar Noir by Guy Laroche, 2.6oz Intense Cooling Deodorant Stick Men",Deodorant,15.95,US $15.95/ea,10.0,More than 10 available / 257 sold,257.0,"Mar 24, 2024 07:42:00 PDT","Hicksville, New York, United States",Hombre
Viktor & Rolf,Spicebomb Night Vision by Viktor & Rolf cologne men EDT 3 / 3.0 oz New in Box,Eau de Toilette,68.99,US $68.99/ea,7.0,7 available / 27 sold,27.0,"May 22, 2024 10:04:40 PDT","Melissa, Texas, United States",Hombre
Zara,ZARA Sunrise On The Red Sand Dunes (Mylene Alran) 3.4oz (100ml) EDP Spray SEALED,Eau de Parfum,58.95,US $58.95,5.0,5 available / 12 sold,12.0,"May 23, 2024 21:06:08 PDT","Englewood, New Jersey, United States",Hombre
Armaf,Armaf Odyssey Mandarin Sky Eau de Parfum for Men 3.4 Oz / 100ml,Eau de Parfum,33.99,US $33.99,22.0,22 available / 2 sold,2.0,"May 19, 2024 18:24:26 PDT","Miami, Florida, United States",Hombre
Milestone Perfumes,Intimation By Milestone Eau de Parfum 3.4 oz Men,Eau de Parfum,34.99,US $34.99,8.0,8 available / 4 sold,4.0,No Especificado,"Virginia Beach, Virginia, United States",Hombre
ISSEY MIYAKE,L'Eau D'Issey by Issey Miyake Pour Homme Eau De Toilette ~ 2.5 FL OZ ~ Sealed,Eau de Toilette,26.95,US $26.95,4.0,4 available / 5 sold,5.0,No Especificado,"Oneida, Tennessee, United States",Hombre
KENZO,Kenzo Homme 3.7 oz/ 110 ml Eau de Toilette Intense Spray for Men. New Sealed Box,Eau de Toilette,47.99,US $47.99/ea,10.0,10 available / 165 sold,165.0,"May 24, 2024 08:20:39 PDT","Katy, Texas, United States",Hombre
Mercedes-Benz,Mercedes-Benz Men's Mercedes-Benz Club Black EDT 3.4 oz Fragrances 3595471041197,Eau de Toilette,49.81,US $49.81,3.0,3 available / 15 sold,15.0,"May 22, 2024 20:56:36 PDT","Brooklyn, New York, United States",Hombre
As Show,Eros Eau de Toilette Spray 3.4 oz EDP Cologne for Men New In Box,Eau de Toilette,35.99,US $35.99/ea,10.0,10 available / 46 sold,46.0,"May 23, 2024 17:33:21 PDT","New York,United States, Taiwan",Hombre
Armaf,Club De Nuit Intense (Limited Edition) Armaf men Pure Parfum 3.6 oz New in Box,De Nuit,62.99,US $62.99/ea,3.0,3 available / 61 sold,61.0,"May 23, 2024 00:04:13 PDT","Melissa, Texas, United States",Hombre
Yves Saint Laurent,YSL Y L'ELIXIR Parfum Concentre 10ml/.33 TRAVEL SPRAY Men YVES SAINT LAURENT NEW,Perfume,25.95,US $25.95,10.0,More than 10 available / 2 sold,2.0,"May 22, 2024 18:23:16 PDT","Sammamish, Washington, United States",Hombre
Lalique,Encre Noire A Lextreme / Lalique EDP Spray 3.3 oz (100 ml) (m),Eau de Parfum,28.19,US $28.19,3.0,3 available / 10 sold,10.0,"May 21, 2024 15:32:31 PDT","Brooklyn, New York, United States",Hombre
Liz Claiborne,Curve Wave Cologne for Men by Liz Claiborne 4.2 oz New in Box / Can,"Eau de Toilette, Cologne Spray",17.02,US $17.02/ea,73.0,"73 available / 3,823 sold",3823.0,"May 09, 2024 16:02:55 PDT","Dallas, Texas, United States",Hombre
Givenchy,Givenchy PI by Givenchy Eau de Toilette for Men 3.3 oz / 100 ml *NEW SEALED BOX*,EDT,44.99,US $44.99,10.0,More than 10 available / 32 sold,32.0,"May 08, 2024 10:32:03 PDT","Miami, Florida, United States",Hombre
Unbranded,Men's Perfume-Cupid Hypnosis Pheromone-Infused Cologne Fragrances Charm Toilette,Perfume,15.99,US $15.99,10.0,More than 10 available / 136 sold,136.0,"May 23, 2024 14:39:34 PDT","Houston, Texas, United States",Hombre
Calvin Klein,Calvin Klein Euphoria Men 3.3 oz After Shave 100 ml NIB,Aftershave,23.79,US $23.79/ea,5.0,5 available / 83 sold,83.0,"May 23, 2024 15:45:55 PDT","Edison, New Jersey, United States",Hombre
Giorgio Armani,Armani Acqua Di Gio for Men 2 Piece Set 3.4 oz EDT + Deodorant *NEW IN BOX*,Eau de Toilette,54.99,US $54.99,10.0,More than 10 available / 384 sold,384.0,"Mar 27, 2024 09:01:18 PDT","Miami, Florida, United States",Hombre
Paco Rabanne,Paco Rabanne Men's Ultrared EDT Spray 3.4 oz Fragrances 3349666005972,Eau de Toilette,36.65,US $36.65,3.0,3 available / 11 sold,11.0,"May 23, 2024 10:20:53 PDT","Brooklyn, New York, United States",Hombre
John Varvatos,JOHN VARVATOS 4.2 oz EDT Cologne for Men New In Box Sealed,Eau de Toilette,33.36,US $33.36/ea,4.0,4 available / 453 sold,453.0,"May 20, 2024 20:52:08 PDT","Dallas, Texas, United States",Hombre
Ralph Lauren,SAFARI by RALPH LAUREN Cologne for Men EDT 4.2 oz New In Box,Eau de Toilette,54.52,US $54.52/ea,51.0,51 available / 143 sold,143.0,"May 23, 2024 08:22:12 PDT","Dallas, Texas, United States",Hombre
Moschino,Uomo Moschino by Moschino 4.2 oz EDT Cologne for Men New In Box,Eau de Toilette,22.87,US $22.87/ea,74.0,74 available / 440 sold,440.0,"May 22, 2024 09:09:10 PDT","Dallas, Texas, United States",Hombre
Giorgio Armani,Giorgio Armani Acqua di Gio Profumo 4.2 oz EDC Cologne for Men Spray New IN Box,Eau de Cologne,129.99,US $129.99,0.0,Last One / 14 sold,14.0,"May 23, 2024 02:25:32 PDT","California or Hong Kong, Hong Kong",Hombre
Ralph Lauren,Polo Green by Ralph Lauren 8 / 8.0 oz EDT Cologne for Men New In Box,Eau de Toilette,72.56,US $72.56,10.0,"More than 10 available / 3,171 sold",3171.0,"May 23, 2024 04:38:13 PDT","Hackensack, New Jersey, United States",Hombre
Azzaro,Azzaro Sport by Azzaro cologne for men EDT 3.38 oz New in Box,Eau de Toilette,18.96,US $18.96/ea,0.0,"Limited quantity available / 1,034 sold",1034.0,"May 20, 2024 22:52:48 PDT","Dallas, Texas, United States",Hombre
Coty,PLAYBOY HOLLYWOOD Cologne by Coty 3.4 oz Eau de Toilette Spray for Men NEW INBOX,Eau de Toilette,9.99,US $9.99/ea,7.0,7 available / 103 sold,103.0,"May 23, 2024 12:45:56 PDT","TX, United States",Hombre
Dior,Eau Sauvage by Christian Dior cologne for men EDT 3.3 / 3.4 oz UNBOXED AS IMAGED,Eau de Toilette,67.99,US $67.99/ea,5.0,5 available / 28 sold,28.0,"Apr 30, 2024 19:09:09 PDT","Princeton Junction, New Jersey, United States",Hombre
Franck Olivier,Franck Olivier Men's Night Touch EDT 3.4 oz Fragrances 3516642117114,Fragrances,17.85,US $17.85,3.0,3 available / 6 sold,6.0,"May 23, 2024 20:14:23 PDT","Brooklyn, New York, United States",Hombre
Kenneth Cole,Blue Kenneth Cole Cologne for Men 3.4 oz 3.3 edt Spray New in Box,Eau de Toilette,28.42,US $28.42/ea,60.0,60 available / 731 sold,731.0,"May 19, 2024 19:06:00 PDT","Dallas, Texas, United States",Hombre
Missoni,Missoni Men's Pour Homme EDP Spray 3.4 oz (Tester) Fragrances 8011003841431,Fragrances,30.07,US $30.07,3.0,3 available / 12 sold,12.0,"May 23, 2024 20:20:19 PDT","Brooklyn, New York, United States",Hombre
Halston,Halston Z -14 by Halston Cologne 4.2 oz EDC For Men New tester,Eau de Cologne,15.51,US $15.51/ea,113.0,"113 available / 4,443 sold",4443.0,"May 21, 2024 06:22:07 PDT","Dallas, Texas, United States",Hombre
Cologne,GIVENCHY POUR HOMME Cologne for Men 3.4 oz / 3.3 oz EDT New in Box,Eau de Toilette,38.94,US $38.94/ea,66.0,"66 available / 2,247 sold",2247.0,"May 24, 2024 10:18:06 PDT","Dallas, Texas, United States",Hombre
Paco Rabanne,1 Million Parfum by Paco Rabanne Parfum Spray (Tester) 3.4 oz Mens,Eau de Parfum,68.99,US $68.99/ea,6.0,6 available / 59 sold,59.0,"May 23, 2024 23:00:53 PDT","Melissa, Texas, United States",Hombre
Unbranded,Cologne For Men Lot 2 Piece,Eau de Cologne,18.0,US $18.00/ea,5.0,5 available / 3 sold,3.0,No Especificado,"Phenix City, Alabama, United States",Hombre
YSL,3.3 oz YSL Yves Saint Laurent Y Eau de Perfume Spray Cologne For Men,Eau de Parfum,49.99,US $49.99,10.0,More than 10 available / 12 sold,12.0,"Apr 29, 2024 17:51:10 PDT","Dayton,New Jersey,USA, Hong Kong",Hombre
PRADA,Prada Luna Rossa Ocean Eau de Toilette 3.3 oz / 100 ml Spray With Box NEW,Eau de Toilette,76.5,US $76.50/ea,2.0,2 available / 8 sold,8.0,"Apr 26, 2024 10:06:31 PDT","Rochester, New York, United States",Hombre
Baron,THE BARON by BARON 4.5 oz EDC For Men New in Box,Eau de Cologne,28.38,US $28.38/ea,4.0,"4 available / 1,433 sold",1433.0,"May 16, 2024 20:45:13 PDT","Dallas, Texas, United States",Hombre
Paco Rabanne,One Million Golden Oud Parfum Intense By Paco Rabanne Sample 1.5ml New Release,Parfum Intense,11.95,US $11.95/ea,10.0,More than 10 available / 18 sold,18.0,"May 08, 2024 03:13:17 PDT","Pearland, Texas, United States",Hombre
Giorgio Armani,ACQUA DI GIO PROFONDO GIORGIO ARMANI 0.5oz / 15ml  EDP Spray NEW IN SEALED BOX,Eau de Parfum,27.0,US $27.00,6.0,6 available / 5 sold,5.0,"May 19, 2024 15:46:01 PDT","McLean, Virginia, United States",Hombre
Liz Claiborne,Bora Bora by Liz Claiborne cologne for men EDC 3.3 / 3.4 oz New in Box,Eau de Cologne,17.29,US $17.29/ea,226.0,"226 available / 1,370 sold",1370.0,"May 24, 2024 07:21:08 PDT","Dallas, Texas, United States",Hombre
adidas,Adidas Dynamic Pulse Cologne Men 3.4 / 3.3 oz EDT Brand New in Box,Eau de Toilette,11.58,US $11.58,10.0,More than 10 available / 17 sold,17.0,No Especificado,"New York, New York, United States",Hombre
PRADA,PRADA Luna Rossa Sport 3.3oz Men's Eau de Toilette - LD008300,Eau de Toilette,79.99,US $79.99,5.0,5 available / 1 sold,1.0,No Especificado,"Memphis, Tennessee, United States",Hombre
Armaf,Club De Nuit  By Armaf 3.6/3.4oz./105ml Edp Spray For Women New In Box,Eau de Parfum,28.8,US $28.80/ea,10.0,More than 10 available / 712 sold,712.0,"May 12, 2024 16:15:40 PDT","Brooklyn, New York, United States",Hombre
Gucci,Guilty Pour Homme Eau de Parfum / Gucci EDP Spray 3.0 oz (90 ml) (m),Eau de Parfum,74.25,US $74.25,3.0,3 available / 16 sold,16.0,"May 23, 2024 10:32:44 PDT","Brooklyn, New York, United States",Hombre
PRADA,Prada Luna Rossa Black / Prada EDP Spray 3.4 oz (100 ml) (m),Eau de Parfum,90.45,US $90.45,3.0,3 available / 19 sold,19.0,"May 24, 2024 08:32:51 PDT","Brooklyn, New York, United States",Hombre
Dolce&Gabbana,12 Dolce & Gabbana The One Luminous Night Exclusive Edition Sample Spray 0.8ml,Eau de Parfum,28.95,US $28.95,0.0,Last One / 81 sold,81.0,"May 22, 2024 03:59:00 PDT","Pearland, Texas, United States",Hombre
Guerlain,Heritage by Guerlain 3.4oz/100ml Eau De Toilette Spray for Men New In Box,Eau de Toilette,94.99,US $94.99,3.0,3 available / 24 sold,24.0,"Apr 14, 2024 16:22:25 PDT","Brooklyn, New York, United States",Hombre
Kenneth Cole,Black Kenneth Cole Cologne for Men 3.3 / 3.4 oz Brand New In Box,Eau de Toilette,24.14,US $24.14/ea,10.0,"More than 10 available / 9,265 sold",9265.0,"May 24, 2024 08:16:12 PDT","Hackensack, New Jersey, United States",Hombre
